{
  "schema_version": 1,
  "artifact_role": "BASE_V9_3_RELEASE_EVIDENCE",
  "release_line": "v9.3.0",
  "evidence_status": "RECORDED_ON_TRUSTED_MAIN_BEFORE_PIN_FINALIZATION",
  "repository": "alsdmlals4-eng/Base",
  "candidate_issue": 107,
  "candidate_pull_request": 108,
  "release_payload_commit": "30ca6c7b5f93521f0eb0eed42d01437cd43c50ae",
  "candidate_registry": {
    "path": "skills/SKILL_REGISTRY.json",
    "sha256": "9847bb2b225c776ad7916930f0f48c490bc2a898bea8e02ea1fdd0e6caac60c1",
    "hash_definition": "RAW_FILE_BYTES_SHA256"
  },
  "validation": {
    "base_v93_contract_ci": "PASSED",
    "full_python_suite": "PASSED_319_WITH_1_DECLARED_SKIP",
    "integrity": "PASSED",
    "generated_artifacts": "PASSED",
    "windows_smoke": "PASSED"
  },
  "product_evidence": {
    "godot_runtime": "NOT_RUN",
    "device": "NOT_RUN",
    "accessibility": "NOT_RUN",
    "human_validation": "NOT_RUN"
  }
}
